{
  "project_name": "task-management-api",
  "last_session": "2024-01-15T18:00:00Z",
  "current_phase": "authentication-implementation",
  "completed_tasks": ["SETUP-001", "DB-001", "AUTH-001", "AUTH-002"],
  "active_tasks": [],
  "blockers": [
    {
      "task_id": "AUTH-003",
      "description": "jsonwebtoken library not installed - blocking JWT middleware implementation",
      "severity": "high",
      "reported_at": "2024-01-15T15:30:00Z"
    }
  ],
  "next_priorities": ["AUTH-003"],
  "git_baseline": "e5f6g7h",
  "notes": "Registration and login endpoints complete with passing E2E tests. JWT middleware blocked by missing dependency - needs installation before next session.",
  "session_history": [
    {
      "session_id": "session-001",
      "timestamp": "2024-01-14T16:30:00Z",
      "tasks_completed": ["SETUP-001", "DB-001"],
      "duration_minutes": 120,
      "summary": "Initial project setup: database schema for users and tasks, environment configuration, dependency installation"
    },
    {
      "session_id": "session-002",
      "timestamp": "2024-01-15T18:00:00Z",
      "tasks_completed": ["AUTH-001", "AUTH-002"],
      "duration_minutes": 180,
      "summary": "Implemented user registration and login endpoints. Both have passing unit and E2E tests. Discovered missing JWT library for middleware."
    }
  ],
  "metrics": {
    "total_sessions": 2,
    "total_features": 5,
    "features_completed": 4,
    "features_failing": 0,
    "test_coverage_percent": 88.5
  }
}
