{
  "project_name": "task-management-api",
  "last_session": "2024-01-14T16:30:00Z",
  "current_phase": "infrastructure-setup",
  "completed_tasks": ["SETUP-001", "DB-001"],
  "active_tasks": [],
  "blockers": [],
  "next_priorities": ["AUTH-001", "AUTH-002", "AUTH-003"],
  "git_baseline": "a1b2c3d",
  "notes": "Database schema created and tested. Infrastructure validated by IT Specialist. Ready to begin authentication implementation in next session.",
  "session_history": [
    {
      "session_id": "session-001",
      "timestamp": "2024-01-14T16:30:00Z",
      "tasks_completed": ["SETUP-001", "DB-001"],
      "duration_minutes": 120,
      "summary": "Initial project setup: database schema for users and tasks, environment configuration, dependency installation"
    }
  ],
  "metrics": {
    "total_sessions": 1,
    "total_features": 5,
    "features_completed": 2,
    "features_failing": 0,
    "test_coverage_percent": 85.0
  }
}
