{
  "project_name": "task-management-api",
  "last_session": "2024-01-16T17:00:00Z",
  "current_phase": "complete",
  "completed_tasks": ["SETUP-001", "DB-001", "AUTH-001", "AUTH-002", "AUTH-003"],
  "active_tasks": [],
  "blockers": [],
  "next_priorities": [],
  "git_baseline": "i9j0k1l",
  "notes": "All features complete and passing! JWT middleware implemented after installing missing dependency. Full E2E test suite passing. Project ready for deployment.",
  "session_history": [
    {
      "session_id": "session-001",
      "timestamp": "2024-01-14T16:30:00Z",
      "tasks_completed": ["SETUP-001", "DB-001"],
      "duration_minutes": 120,
      "summary": "Initial project setup: database schema for users and tasks, environment configuration, dependency installation"
    },
    {
      "session_id": "session-002",
      "timestamp": "2024-01-15T18:00:00Z",
      "tasks_completed": ["AUTH-001", "AUTH-002"],
      "duration_minutes": 180,
      "summary": "Implemented user registration and login endpoints. Both have passing unit and E2E tests. Discovered missing JWT library for middleware."
    },
    {
      "session_id": "session-003",
      "timestamp": "2024-01-16T17:00:00Z",
      "tasks_completed": ["AUTH-003"],
      "duration_minutes": 90,
      "summary": "Resolved blocker by installing jsonwebtoken library. Implemented JWT middleware for protected routes. All features now passing with full test coverage."
    }
  ],
  "metrics": {
    "total_sessions": 3,
    "total_features": 5,
    "features_completed": 5,
    "features_failing": 0,
    "test_coverage_percent": 92.0
  }
}
